<?xml version="1.0" encoding="UTF-8"?><!DOCTYPE layout SYSTEM "http://schemas.tomatocms.com/dtd/layout.dtd"><layout><container cols="12"><container cols="6"><widget module="news" name="breadcump" load="php"><title><![CDATA[Breadcump]]></title><resources></resources><params><param name="category_id" type="global" /></params></widget><defaultOutput /></container><container cols="4"></container><container cols="2" position="last"></container></container></layout>