<?xml version="1.0" encoding="UTF-8"?><!DOCTYPE layout SYSTEM "http://schemas.tomatocms.com/dtd/layout.dtd"><layout><container cols="12"><widget module="news" name="category" load="php"><title><![CDATA[Category]]></title><resources></resources><params><param name="category_id" type="global" /></params></widget></container><container cols="12"><container cols="6" position="first"><widget module="news" name="breadcump" load="php"><title><![CDATA[Breadcump]]></title><resources></resources><params><param name="category_id" type="global" /></params></widget><widget module="utility" name="socialshare" load="php"><title><![CDATA[Share via social networks]]></title><resources></resources><params></params></widget><defaultOutput /><widget module="comment" name="comment" load="php"><title><![CDATA[Latest comments]]></title><resources></resources><params><param name="limit"><value><![CDATA[5]]></value></param><param name="allow_comment"><value><![CDATA[1]]></value></param><param name="show_avatar"><value><![CDATA[0]]></value></param><param name="avatar_size"><value><![CDATA[]]></value></param></params></widget><widget module="news" name="older" load="php"><title><![CDATA[Older articles]]></title><resources></resources><params><param name="article_id" type="global" /><param name="category_id"><value><![CDATA[1]]></value></param><param name="limit"><value><![CDATA[15]]></value></param></params></widget></container><container cols="4"><widget module="news" name="sticky" load="php"><title><![CDATA[Sticky articles]]></title><resources><resource type="javascript" src="http://thoibaonganhang.vn//js/jquery.cycle/jquery.cycle.all.min.js" /></resources><params><param name="category_id" type="global" /><param name="limit"><value><![CDATA[5]]></value></param><param name="num_articles_per_row"><value><![CDATA[5]]></value></param></params></widget><widget module="news" name="mostviewed" load="php"><title><![CDATA[Most viewed]]></title><resources><resource type="javascript" src="http://thoibaonganhang.vn//js/jquery.cycle/jquery.cycle.all.min.js" /></resources><params><param name="category_id" type="global" /><param name="limit"><value><![CDATA[5]]></value></param></params></widget><widget module="multimedia" name="slideshow" load="php"><title><![CDATA[Slideshow]]></title><resources><resource type="javascript" src="http://thoibaonganhang.vn//js/jquery.cycle/jquery.cycle.all.min.js" /></resources><params><param name="limit"><value><![CDATA[10]]></value></param></params></widget></container><container cols="2" position="last"></container></container></layout>